Title,Description,Date,Link,Setup Support,FINAL SCORE,Origin,Author
AI-Powered Document Retrieval,"Takes a user query and metadata filters as input → Retrieves relevant chunks from a vector database, reranks them using Cohere, and applies metadata filtering → Outputs refined, contextually relevant information.",2025/07/24,https://drive.google.com/file/d/1Sl8ZooBy77pTlVu6exNHZC4zOTD9SMox/view?usp=drivesdk,https://www.youtube.com/watch?v=xWhX61651H8,4,Skool,Nate Herk
RAG Agent Setup with Supabase,"Workflow automates setup of a Retrieval-Augmented Generation (RAG) agent. It ingests documents, recursively splits them, embeds them, and stores them in Supabase (vector database) and Postgres (chat memory) for AI-powered question answering.",2025/07/24,https://drive.google.com/file/d/1Mne2Bimx-druSo78rga_DBO8hp5jn8fF/view?usp=drivesdk,https://www.youtube.com/watch?v=JjBofKJnYIU,4,Skool,Nate Herk
Human-in-Loop Calendar Agent,"This workflow automates calendar scheduling by integrating Google Calendar, Airtable, and Telegram. It takes meeting requests as input, verifies contacts against Airtable, checks for conflicts in Google Calendar, and prompts a human via Telegram for confirmation before creating, updating, or deleting the event in Google Calendar.",2025/07/24,https://drive.google.com/file/d/1BoqlUTO3FU-kg9Z8vyioIy8keSxV8PxX/view?usp=drivesdk,https://www.youtube.com/watch?v=z-gDDajSSNE,4,Skool,Nate Herk
AI Viral Baby Video System,"Takes baby video ideas from Google Sheets, uses OpenAI for text/images, 11 Labs for audio, headro.com for video rendering, and uploads to Google Drive/YouTube.",2025/07/24,https://drive.google.com/file/d/1HzP9aG6UNKFOrdZx4amgGiUafGt9_k6D/view?usp=drivesdk,https://www.youtube.com/watch?v=Q7pJcZAPuGc,4,Youtube,Oleg Melnikov
Web Scraping Automation,"This workflow uses Crawl4AI and n8n to scrape website data. It takes a URL as input, processes it using various scraping strategies (basic extraction, LLM-driven structuring, and CSS selectors), and outputs structured data.",2025/07/24,https://drive.google.com/file/d/1-IYnlP9zmC-_ThiqddCNSLu5_c38Sk-9/view?usp=drivesdk,https://www.youtube.com/watch?v=1CDGpbZItiY,4,Skool,Mahmut Kasimoglu
AI Website Chat Agent,"This workflow uses OpenAI and Google Calendar to create an AI-powered chat agent for websites. It takes user input via a chat widget, processes it using an OpenAI Chat model with memory, and can schedule events via Google Calendar. The output is a functional chat agent embedded on a website.",2025/07/24,https://drive.google.com/file/d/1UHGKJDYPwdQP3DIVDmvlgWBhBpZ3-7ws/view?usp=drivesdk,https://www.youtube.com/watch?v=c2kaOwkkhpo,4,Gumroad,Nick Saraev
AI Agent Dynamic Model Routing,"Workflow uses Slack input to dynamically select and route tasks to the most cost-effective LLM (Gemini, GPT, Claude) via OpenRouter, integrating logging with Google Sheets and Superbase for RAG.",2025/07/24,https://drive.google.com/file/d/1dcRO0RKgiYlaaLhH4j4y9Z921f18nIob/view?usp=drivesdk,https://www.youtube.com/watch?v=gwCQF--cARA,4,Skool,Nate Herk
Social Media Auto-Publisher,"This workflow automates social media posting. It takes content and media details from a Google Sheet and Google Drive, then uses a social media API to publish across nine platforms: Instagram, YouTube, Facebook, Threads, LinkedIn, Twitter, TikTok, Blue Sky, and Pinterest.",2025/07/24,https://drive.google.com/file/d/1mQhUpATTN2xr2euyFaZef9zgLs4bRb_I/view?usp=drivesdk,https://www.youtube.com/watch?v=D9okDd_1tBI,4,Sabrina.dev,Sabrina Ramonov 🍄
Automated Lead Nurturing,"This workflow retrieves leads from Apollo, processes and filters them using Google Sheets, then drafts personalized emails via OpenAI. Scheduled emails manage outreach.",2025/07/24,https://drive.google.com/file/d/198XfXrIkvqtvd-59_oZZzO5NIbjDDLWm/view?usp=drivesdk,https://www.youtube.com/watch?v=ZD2DlnuqCrA,4,Skool,Mahmut Kasimoglu
Human-in-the-Loop Sales Automation,"This workflow automates sales outreach by capturing leads from Airtable, generating personalized emails with AI, refining them via human feedback through Gmail, and structuring output for optimized content generation using Claude 3.5.",2025/07/24,https://drive.google.com/file/d/1vdVhAwFq50jUyYZdc_ywduRRKn9F4BxQ/view?usp=drivesdk,https://www.youtube.com/watch?v=FcAAlOw6KZ8,4,Skool,Nate Herk
Multi-Agent Workflow Automation,"This workflow uses a supervisor agent to delegate tasks to specialized sub-agents for email, contact, calendar, and context management, improving efficiency and debugging.  Input tasks are received by the supervisor, processed by sub-agents, and output as completed actions.",2025/07/24,https://drive.google.com/file/d/1TMNsQPbtoBrS5rQqeIfF5q8e9q4KnNKq/view?usp=drivesdk,https://www.youtube.com/watch?v=Ah-1-Lda4DU,4,Skool,Mahmut Kasimoglu
AI Competitor Price Tracker,"Workflow scrapes competitor product prices using HTTP requests and AI, updates a Google Sheet, visualizes data in Looker Studio, and sends Slack notifications upon price changes.",2025/07/24,https://drive.google.com/file/d/1czKiLl6jwd6dXGeChqxRIgnNBsD4KNOZ/view?usp=drivesdk,https://www.youtube.com/watch?v=KFB6BBcbIjg,4,Circle,Ben AI
AI Stock Analysis Bot,Telegram bot receives stock ticker requests → transcribes audio/text using OpenAI Whisper → GPT-4 performs technical analysis & generates charts via ChartImg API → delivers analysis/charts to user & saves for automated reporting.,2025/07/24,https://drive.google.com/file/d/1lLYL4Wu1q9KtLg9SUbKOF9wI-POXs8EY/view?usp=drivesdk,https://www.youtube.com/watch?v=94vh6hSiP9s,4,Skool,5minAI
AI Image Generation and Storage,This workflow uses OpenAI's image generation API to create images from text or enhance existing images. It converts the generated images into files and stores them in Google Drive.,2025/07/24,https://drive.google.com/file/d/11QXpTSmPZzfONzmjUoFV5TyK-BBmFLgU/view?usp=drivesdk,https://www.youtube.com/watch?v=SAUxo5fcLMs,4,Gumroad,MagicOps AI
Automated Web Scraping System,"This workflow automates web scraping using Apify and n8n. It takes a website URL as input, scrapes data like phone numbers and emails, filters and aggregates the results, and outputs the structured data into a Google Sheet.",2025/07/24,https://drive.google.com/file/d/18fzu5XEWAVOszSqNoZFPBAHsCtVK2_af/view?usp=drivesdk,https://www.youtube.com/watch?v=PxQwzoPmP3M,4,Gumroad,Jono Catliff
Parallel Processing Subworkflows,Takes a large dataset as input → splits it into smaller chunks and processes each chunk concurrently using subworkflows → outputs the processed data much faster.,2025/07/24,https://drive.google.com/file/d/1Jae-I4XhiuEaxGC8Rycu8tJzmLQthZ7v/view?usp=drivesdk,https://www.youtube.com/watch?v=qNW9KaLe1nY,4,Skool,Nate Herk
Agentic RAG Workflow,"Takes various data sources (Google Drive files, SQL databases) as input → Processes them using dynamic vector and SQL lookups with OpenAI embeddings → Outputs comprehensive, source-cited information retrieval and data analysis results.",2025/07/24,https://drive.google.com/file/d/1OySSnBMwKc7TdGcqjgEAVgHfvZJe7qE5/view?usp=drivesdk,https://www.youtube.com/watch?v=mQt1hOjBH9o,5,GitHub,Cole Medin
Automated LinkedIn Lead Outreach,"This workflow automates LinkedIn outreach. It takes Apollo leads as input, enriches them with AI-powered personalization using OpenAI, and sends targeted connection requests via PhantomBuster, logging data in Google Sheets.",2025/07/24,https://drive.google.com/file/d/1jqEhOGzb-S1FgXVV-yS2CARK26To-eOJ/view?usp=drivesdk,https://www.youtube.com/watch?v=gsPGdq2C97c,4,Gumroad,Nick Saraev
Automated Twitter Data Extraction,"This workflow automates the extraction of Twitter/X data using the Twitter API. It takes search parameters as input, processes the data through a loop with dynamic pagination, and outputs the extracted tweets (IDs, URLs, content, likes, views, dates) into a Google Sheet.",2025/07/24,https://drive.google.com/file/d/1fPTYj0OSHGvVOP2LQTdqA6l3GSms2wib/view?usp=drivesdk,https://www.youtube.com/watch?v=lEo7IAgj0UY,4,Skool,Nate Herk
AI-Powered Cold Email Automation,"Takes lead data from Apollo and enriches it using Apify scraping. Processes this data with OpenAI's GPT-4.1 to generate personalized icebreakers for 1000+ cold emails and sends them via Instantly, managing data through Google Sheets.",2025/07/25,https://drive.google.com/file/d/1rzf2R0u4QYHBkE5u7nH29PROQgEQYYVu/view?usp=drivesdk,https://www.youtube.com/watch?v=oAWe5wFwHlo,4,Gumroad,Nick Saraev
AI Workflow Demo,"This n8n workflow demonstrates two AI-powered automation systems: an email labeling system (Gmail, LLM classification, labeling, notifications) and a complaint ticket processing system (Google Sheets, email notifications).",2025/07/24,https://drive.google.com/file/d/19GstsGXwl3vX2tSTfU1Q_z7CXis89qoz/view?usp=drivesdk,https://www.youtube.com/watch?v=nQbd56j_dZ0,4,Skool,Mahmut Kasimoglu
AI-Powered CV Processing,"This workflow automates CV screening by fetching resumes from Gmail, extracting text from attachments (PDFs, DOCs), and using OpenAI to match candidate data with Airtable job listings, providing a ranked candidate list based on custom criteria.",2025/07/24,https://drive.google.com/file/d/1S-Su9_tQP1yFnNgldz-KAw3vMF-uIxgy/view?usp=drivesdk,https://www.youtube.com/watch?v=iNjFF4RzoVg,4,Skool,5minAI
AI Viral LinkedIn Post Generator,"Workflow scrapes competitor LinkedIn profiles, extracts multimedia content, and uses AI (OpenAI, Perplexity) to rewrite viral posts. Includes Telegram agent for voice-to-text post generation and Airtable integration.",2025/07/24,https://drive.google.com/file/d/1raTYt5u6mP-yXCfDYgFQtRIGRoXzv-yG/view?usp=drivesdk,https://www.youtube.com/watch?v=GmlQZ8MG7HY,4,Youtube,Oleg Melnikov
Automated Lead Nurturing,"This workflow takes new Google Form submissions as input, processes them using JavaScript and OpenAI's GPT-4 to generate personalized emails, updates lead status and tags in Google Sheets, and sends Slack notifications.",2025/07/24,https://drive.google.com/file/d/1kcOi0TAT-MXEMgJgzIKAE3K-m9Y1eF_Q/view?usp=drivesdk,https://www.youtube.com/watch?v=fWtXJswvUcA,4,Skool,Nate Herk
AI-Powered Meta Ad Automation,"This workflow automates meta ad campaigns from product research to performance tracking. It takes product details as input, uses AI to generate ad angles and scripts, deploys ads via the Facebook Graph API, tracks performance, and optimizes ROI. The output is a fully managed and optimized ad campaign.",2025/07/24,https://drive.google.com/file/d/1u5F-1weLTj25Ajqu114HLCZVV62iVRib/view?usp=drivesdk,https://www.youtube.com/watch?v=Rm3ObJXsuOI,5,Circle,Ben AI
AI Customer Support Agent,Takes customer queries as input → processes them using GPT-4 and a Google Sheets database with order details → outputs automated support responses and updates order status (refunds/cancellations).,2025/07/24,https://drive.google.com/file/d/1C9nP3bS72ABwY3t1i9WJ36eLivGaQDVS/view?usp=drivesdk,https://www.youtube.com/watch?v=Soa8o82q5qY,3,Skool,Mahmut Kasimoglu
AI-Powered File Chatbot,"Workflow ingests files from Google Drive and Supabase, processes and vectorizes them using YamaParse, and enables AI-powered chat interactions with file content via OpenAI.",2025/07/24,https://drive.google.com/file/d/1N82U4wC0Ad11p4tx0y0mBNS3GXwf7qjI/view?usp=drivesdk,https://www.youtube.com/watch?v=NB6LhvObiL4,4,Skool,5minAI
Automated Instagram Growth System,"Scrapes Instagram Reels using Apify, transcribes them with OpenAI Whisper, filters and tailors content using GPT and Perplexity AI, and manages data in Google Sheets for automated social media growth.",2025/07/24,https://drive.google.com/file/d/1oe6wc6l_f0RWB8NsTnDQmJ_Gi-kATUJ_/view?usp=drivesdk,https://www.youtube.com/watch?v=9zBtU1mwOR4,4,Gumroad,Nick Saraev
Multi-Agent Orchestrator,"Workflow takes complex tasks as input → breaks them down into sub-tasks handled by specialized agents (email, contacts, calendar, content) → outputs completed task via integrated services like Gmail, Airtable, and chosen language models (GPT-4.1 mini, Flash).",2025/07/24,https://drive.google.com/file/d/1f93z80VSghfYTTRQyR4GdV1mvrNySwF_/view?usp=drivesdk,https://www.youtube.com/watch?v=0iUNOmeU7O4,4,Skool,Nate Herk
AI Proposal Generator,Takes form data and uses OpenAI to generate customized proposals from a Google Slides template. Distributes via Gmail and enhances with Pandadoc.,2025/07/24,https://drive.google.com/file/d/1D4DpjliW6aUBsSqpXXXHvLbGw9-gg2mi/view?usp=drivesdk,https://www.youtube.com/watch?v=viN9gX030T4,4,Gumroad,Nick Saraev
Automated Workflow Tutorial,"This tutorial demonstrates building automated workflows in n8n, triggered by events like form submissions or API calls, which then perform actions such as sending personalized emails, generating content with OpenAI, and updating CRM records.",2025/07/24,https://drive.google.com/file/d/1YvEZqdub73KBP59nGoEGr6JBsrxUDunf/view?usp=drivesdk,https://www.youtube.com/watch?v=r6uX3btBgvw,4,Gumroad,Nick Saraev
AI-Powered Airtable Automation,"This workflow uses an AI agent to enhance Airtable functionality. It takes natural language queries as input, processes them via OpenAI to generate code for Airtable operations (data queries, math, filtering), and outputs results and Mapbox visualizations.",2025/07/24,https://drive.google.com/file/d/1qnMZwUoPfLckLRLpASyJ_h30qzG6kQWi/view?usp=drivesdk,https://www.youtube.com/watch?v=SotqsAZEhdc,4,Skool,5minAI
AI Social Media Automation,"This workflow takes Hacker News articles as input, uses ChatGPT to generate a video script, creates an AI avatar video with HeyGen (optionally integrating 11 Labs voice and Blotato background video), and then publishes it across multiple social media platforms (Instagram, YouTube, Facebook, Threads, LinkedIn, Twitter, TikTok).",2025/07/24,https://drive.google.com/file/d/1I9Gs0h6uOkv63r59H9BdQ75wQ-TQv_F6/view?usp=drivesdk,https://www.youtube.com/watch?v=8sPYxqU1SoQ,5,Sabrina.dev,Sabrina Ramonov 🍄
Automated RAG Document System,"Workflow monitors Google Drive for new files, converts them to text, extracts metadata, and uploads to a Supabase vector database for AI agent retrieval.",2025/07/24,https://drive.google.com/file/d/19s-SAwhk0A5UH1IqHglEpvy4elW60bue/view?usp=drivesdk,https://www.youtube.com/watch?v=Kvf-Pr1LRe4,4,Skool,Nate Herk
AI Multi-Platform Content,"Workflow takes research topics from Google Sheets, uses Tavali API for real-time news retrieval, then generates targeted content for LinkedIn, X, and blogs via specialized AI agents.",2025/07/24,https://drive.google.com/file/d/1f8NEv0kTRgKOY8zO6IWJ-A_CISlP2v8l/view?usp=drivesdk,https://www.youtube.com/watch?v=u2Tuu02r7QI,4,Skool,Nate Herk
No-Code Web Scraping Automation,"This workflow uses Apify actors and n8n to scrape data from websites like TikTok and Google Maps. It triggers Apify actors via HTTP, waits for data retrieval, and polls for results.",2025/07/24,https://drive.google.com/file/d/1z0-FC4tgS6wtVHZDeVLq8g2cL3ry5I-V/view?usp=drivesdk,https://www.youtube.com/watch?v=gZ_RLC25gCw,4,Skool,Nate Herk
AI Agent with Long-Term Memory,"This workflow uses n8n and Zep to build an AI agent with enhanced memory. It takes user input via Telegram, retrieves data from PostgreSQL and a Zep knowledge graph, processes this information to provide context-aware responses, and outputs interactions back to Telegram.",2025/07/24,https://drive.google.com/file/d/1qQZS-pxGIA7fzvlXVk_gh4wsE1N2Tr04/view?usp=drivesdk,https://www.youtube.com/watch?v=kNsX2qu8jHY,4,Skool,Nate Herk
AI Excuse Generator,"Takes user input from a Lovable web app → generates creative excuses using OpenAI's chat model → returns the AI-generated excuse to the app, enhanced with dynamic level system and tone selection.",2025/07/24,https://drive.google.com/file/d/1CSK8YDXwA_THabCtb_4zWeEra4QWvsI9/view?usp=drivesdk,https://www.youtube.com/watch?v=kUpTUEwKnrk,3,Skool,Nate Herk
Local AI Agent with Supabase,"Workflow automates local AI agent setup using n8n, Docker, Supabase database and vector store, Ollama, and Flowise. Input: User configuration and agent parameters. Process: Orchestrates containers, configures environments, sets up Supabase. Output: Fully functional local AI agent.",2025/08/01,https://drive.google.com/file/d/103HVUfEsmwaQTtR6x9EE4rU38rMYNuJm/view?usp=drivesdk,https://www.youtube.com/watch?v=pOsO40HSbOo,4,GitHub,Cole Medin
LinkedIn Viral Post Leads,"This workflow scrapes comments from viral LinkedIn posts, enriches commenter data using API lookups and LLM-based intent analysis, and outputs qualified leads to Airtable for personalized outreach.",2025/08/01,https://drive.google.com/file/d/1VZ52m9sMIW_R0CMHvcRIV6fiNkY-xbO7/view?usp=drivesdk,https://www.youtube.com/watch?v=JftnNwvagKA,4,Gumroad,MagicOps AI
Mistral OCR Document Processing,"Workflow uploads a document (PDF or image), extracts text using Mistral OCR via HTTP requests, and outputs structured data for further processing or AI integration.",2025/08/01,https://drive.google.com/file/d/11pgGKEbRdZJ1UBD7F66uqvqMbHj7LpcT/view?usp=drivesdk,https://www.youtube.com/watch?v=85qo6qC4r-0,4,Skool,Nate Herk
Automated Invoice & Expense Tracking,"Receipts uploaded via form are processed using Gemini AI for metadata extraction and stored in Google Drive.  The workflow splits files, analyzes them, updates a Google Sheet, and sends Slack notifications.",2025/08/01,https://drive.google.com/file/d/13jWdSMXa706My3tk7AMiFwtNh8O2rmQD/view?usp=drivesdk,https://www.youtube.com/watch?v=j9_gps_ZZNU,4,Gumroad,MagicOps AI
Viral Reel Replication,"This workflow scrapes trending Instagram reels, analyzes them using Gemini, and generates insights via OpenAI on recreating key elements.  Input: Viral Reel URL. Process: Data scraping, analysis, content generation. Output: Reproduction guidelines.",2025/08/01,https://drive.google.com/file/d/1UxSAvlFkHKxHK6apjPYiUYHELN71jMfd/view?usp=drivesdk,https://www.youtube.com/watch?v=SQPPM0KLsrM,4,Skool,5minAI
AI Faceless YouTube Automation,"Takes video ideas from Google Sheets → Uses AI to generate script, images, audio, and captions, and merges them into a video → Outputs a finished video ready for YouTube upload.",2025/08/01,https://drive.google.com/file/d/1wlUKsy6nLyYqjZabmSsZDmBYY2Ek1Wkb/view?usp=drivesdk,https://www.youtube.com/watch?v=MjZSsasHSq8,4,Gumroad,Jono Catliff
AI Product Video Generator,"Takes product photo, title, and description via form submission → generates AI image and video using OpenRouter, OpenAI, ImageBB, and RunwayML → delivers final video via email.",2025/08/01,https://drive.google.com/file/d/19iC6OzTbLAhM2Flee9A8ZLozbZrLv50A/view?usp=drivesdk,https://www.youtube.com/watch?v=qV7xOEKEBDA,4,Skool,Nate Herk
TikTok Trend Analyzer,"This workflow scrapes trending TikTok videos using Apify, analyzes them with Google Gemini AI to extract key metrics (hooks, visuals, views, captions), and stores the data in Airtable for viral content strategy.",2025/08/01,https://drive.google.com/file/d/1aF60SqizqGpqkzXOcW0ibfKd9JRIZYvk/view?usp=drivesdk,https://www.youtube.com/watch?v=IWUy79cSp60,4,Gumroad,MagicOps AI
Website to LLM Data,Takes a website URL as input → Crawls and extracts data using Firecrawl and custom prompts → Outputs LLM-ready data in JSON format.,2025/08/01,https://drive.google.com/file/d/1oP0UeN_TKPyorPrFj5d65XV1lJr0SZVy/view?usp=drivesdk,https://www.youtube.com/watch?v=Ee9WtEEd300,4,Skool,Nate Herk
Gemini Media Analyzer,"This workflow automates media analysis. It takes videos, images, or PDFs as input, processes them using the Gemini API via HTTP requests and dynamic JSON handling, and outputs structured data like format and topic.",2025/08/01,https://drive.google.com/file/d/1MOupUtZyl5lBWU9He7zYa0cu1ueoZIsg/view?usp=drivesdk,https://www.youtube.com/watch?v=OWJKGkPEGSw,4,Gumroad,MagicOps AI
AI Video Analysis Workflow,"This workflow automates video analysis by uploading videos from Google Drive, sending them to Gemini AI for emotional and facial analysis via the Jimini API, and storing the AI's ratings and comments in Airtable.",2025/08/01,https://drive.google.com/file/d/1tXohYR_KKzpcakFWPMX_hOVerknXJ15S/view?usp=drivesdk,https://www.youtube.com/watch?v=zehXwwnH8d0,4,Skool,5minAI
Vector Database Optimization,"Workflow automates vector database operations, including data insertion into Pinecone, metadata handling, and implementing text splitting techniques (recursive, token, and character) for optimized Retrieval-Augmented Generation (RAG) embeddings.",2025/08/01,https://drive.google.com/file/d/1vX8n7kVAyZ-GrAuXyvJ5I-GonATGKqXT/view?usp=drivesdk,https://www.youtube.com/watch?v=VBw5PEV-zKw,4,Skool,Nate Herk
AI Clone Video Automation,"This workflow automates the creation of personalized AI clone videos. It takes scripted text as input, uses HeyGen's API to generate videos with chosen avatars and voices, and outputs the finished video link after automated status checks and error handling.",2025/08/01,https://drive.google.com/file/d/1JzQD5r7r-ks5wfVkdtH_DWBkjqQWhC4e/view?usp=drivesdk,https://www.youtube.com/watch?v=llm60n03x3c,4,Skool,Nate Herk
Automated No-Show Reduction,"This workflow takes meeting details as input, enriches them with web and LinkedIn data via scraping and AI summarization, and automates SMS reminders, email approvals, and CRM updates to minimize no-shows. It outputs updated CRM records and notification statuses.",2025/08/01,https://drive.google.com/file/d/1NY8o7vcX6ui78b07VLxUbgixQ-2C7qcU/view?usp=drivesdk,https://www.youtube.com/watch?v=1kZzPslvbXg,4,GitHub,Rory Ridgers
DeepSeek R1 Agent Workflow,"This workflow uses DeepSeek R1 as a planning agent to interpret user commands and generate detailed execution steps. It then employs a tools agent to perform actions like sending emails or creating calendar events via APIs, offering a direct integration with DeepSeek without relying on OpenRouter.",2025/08/01,https://drive.google.com/file/d/1hg1xXMaqf5At7F3qPOp2D9qmkKEv2QKd/view?usp=drivesdk,https://www.youtube.com/watch?v=tjaD65OCoE8,4,Skool,Nate Herk
AI Cold Call Automation,"Takes company names as input → finds decision-makers and phone numbers using Ghost Genius API, generates personalized call scripts with OpenAI → outputs contact details and scripts to Google Sheets.",2025/08/15,https://www.reddit.com/r/n8n/comments/1mp7vhg/aipowered_cold_call_machine_free_template/,,4,Reddit,perceval_38
AI Hotel Concierge Chatbot,"Workflow scrapes hotel website data, builds a knowledge base, and uses an AI agent to answer customer questions via WhatsApp.",2025/08/17,https://www.reddit.com/r/n8n/comments/1mr2vyq/i_built_a_whatsapp_chatbot_and_ai_agent_for/,,4,Reddit,dudeson55
Database Chatbot,Takes natural language questions as input → translates to SQL queries → executes on Postgres database → returns results in user-friendly format.,2025/08/17,https://www.reddit.com/r/n8n/comments/1mhc3ev/i_generated_a_workflow_to_chat_with_your_database/,,4,Reddit,Weak_Birthday2735
AI Agent Army,"Workflow takes natural language commands via Telegram, processes them using multiple specialized AI agents within n8n to perform tasks like email management, scheduling, finance tracking, travel planning, research, and content creation, then outputs results back to Telegram.",2025/08/20,https://www.reddit.com/r/n8n/comments/1mugdof/i_built_an_ai_agent_army_in_n8n_that_completely/,,5,Reddit,LargePay1357
Calorie Tracker from Image,Takes food images as input → Processes them using Google Vision API → Outputs calorie information.,2025/08/28,https://www.reddit.com/r/n8n/comments/1mthwbv/built_myself_an_automation_that_tracks_calories/,,3,Reddit,Odd-Pension-5078
Personalized News Digest,"Workflow gathers news from multiple RSS feeds, filters by user-specified keywords, enriches content with relevant cybersecurity information and exploits, and delivers a formatted summary via email.",2025/08/28,https://www.reddit.com/r/n8n/comments/1myud73/this_has_been_my_most_useful_workflow_yet_heres/,,4,Reddit,ekaa_
AI-Powered Workflow Builder,"Takes a user prompt as input → builds an n8n workflow using AI → outputs a functional workflow that monitors Reddit for mentions, performs sentiment analysis, and sends alerts to Slack.",2025/08/29,https://www.reddit.com/r/n8n/comments/1mypmxl/how_i_vibebuild_n8n_workflows_with_our_cursor_for/,,4,Reddit,Weak_Birthday2735
AI Workflow Generator,Takes natural language instructions as input → generates n8n workflows → outputs functional workflows on the n8n canvas.  Includes error identification and explanation.,2025/08/31,https://www.reddit.com/r/n8n/comments/1n2dsup/n8n_workflow_generator/,,5,Reddit,mrcsvlk
AI UGC Ad Generator,"Takes product details and marketing copy as input, uses Google Veo 3 to generate short video ads, and outputs the finished video files.",2025/09/01,https://www.reddit.com/r/n8n/comments/1n36rea/nano_banana_veo3fast_ai_ugc_ads_for_less_than_1/,,4,Reddit,LargePay1357
Automated Twitter Reply Bot,"Workflow monitors Twitter for specific keywords or community posts, uses AI to generate relevant replies, filters low-quality content, and automatically posts responses while preventing duplicates.  It takes keywords, community IDs, and API keys as input, processes tweets through scraping, AI generation, and filtering, and outputs posted replies and Telegram notifications.",2025/09/13,https://www.reddit.com/r/n8n/comments/1ne4iqy/never_stop_posting_on_x_source_code_included/,,4,Reddit,max1302
AI Virtual Try-On Integration,"Takes customer photos and clothing items as input, processes them using AI to generate virtual try-on images, and outputs the personalized visualization to the e-commerce store.",2025/09/14,https://www.reddit.com/r/n8n/comments/1myo42e/this_n8n_workflow_made_me_close_multiple_clients/,,4,Reddit,Odd-Pension-5078
