Title,Description,Date,Link,Setup Support,FINAL SCORE,Origin,Author
Browser AI Agent,"AI agent uses Airtop and n8n to autonomously navigate websites, clicking and typing like a human to complete tasks such as data scraping or form automation.",2025/07/17,https://www.skool.com/ai-automation-society/new-video-i-built-the-ultimate-browser-agent-with-no-code-n8n-airtop,,4,Skool,Nate Herk
AI Marketing Team,"Single AI agent in n8n creates complete marketing content including images, LinkedIn posts, blog articles, and videos automatically without human intervention.",2025/07/17,https://www.skool.com/ai-automation-society/new-video-i-built-a-marketing-team-with-one-ai-agent-and-no-code-free-n8n-template,,4,Skool,Nate Herk
AI SEO Content Automation,"Takes category, target audience, and specific tool requests as input → performs deep research using prompts optimized for social signals and reviews → generates SEO-optimized articles section by section and publishes to a CMS.",2025/07/17,https://www.reddit.com/r/n8n/comments/1l81jzd/i_built_an_ai_automation_that_writes_seooptimized/,,4,Reddit,dudeson55
AI Agent Builder,"Meta-AI agent in n8n creates custom AI agent workflows from plain English instructions, automatically generating functional n8n workflows with setup guides and direct links.",2025/07/17,https://www.skool.com/ai-automation-society/new-video-i-built-an-ai-agent-that-builds-entire-teams-of-ai-agents-in-n8n-free-template,,5,Skool,Nate Herk
AI Email Assistant,"AI agent in n8n automatically identifies customer support emails, accesses company policies and FAQs, and drafts contextual responses in email threads for review.",2025/07/17,https://www.skool.com/ai-automation-society/new-video-how-i-built-an-ai-agent-to-automate-my-emails-in-n8n,,4,Skool,Nate Herk
AI Lead Generation Workflow,"Takes company names as input → finds and scores leads using AI, enriches profiles, generates personalized emails → outputs lead data to Google Sheets.",2025/07/17,https://www.reddit.com/r/n8n/comments/1m5icja/endtoend_lead_generation_system_with_email/,,4,Reddit,perceval_38
AI Resume Screener,"AI system in n8n analyzes candidate resumes, evaluates strengths, weaknesses, and role fit, providing justified scores and detailed reasoning for hiring decisions.",2025/07/17,https://www.skool.com/ai-automation-society/new-video-watch-me-build-an-ai-resume-analysis-system-with-no-code-in-n8n,,4,Skool,Nate Herk
Jarvis AI Assistant,"Voice-powered AI assistant built with Lovable, ElevenLabs, and n8n creates JARVIS-like interface with speech recognition, tool calling, and automated responses without coding.",2025/07/18,https://www.skool.com/ai-automation-society/new-video-how-i-built-jarvis-with-no-code-tutorial-w-lovable-elevenlabs-n8n,,4,Skool,Nate Herk
N8N Workflow Directory,A public directory of 3000+ free n8n workflows sourced from public repositories.  Provides direct download access without signup.  A future planned feature is an n8n workflow generator for simple use cases.,2025/07/18,https://www.reddit.com/r/n8n/comments/1kuhzyw/i_built_an_n8n_workflow_directory_no_signup/,,4,Reddit,Boby-cat
AI Content Generator,"Automated system uses n8n and Google Veo 3 to generate niche ASMR videos and automatically posts them across YouTube, Instagram, and TikTok platforms.",2025/07/18,https://www.skool.com/ai-automation-society/new-video-this-ai-system-posts-viral-asmr-shorts-hourly-free-template,,3,Skool,Nate Herk
Automated Shorts Creator,"AI system in n8n generates viral short-form videos with AI images, automatically renders content, and posts across YouTube, Instagram, and TikTok for under $1 per video.",2025/07/18,https://www.skool.com/ai-automation-society/new-video-i-built-a-viral-shorts-machine-for-075-using-ai,,3,Skool,Nate Herk
AI Marketing Agent,"Workflow uses an ElevenLabs voice agent connected to an n8n agent to automate marketing tasks. User gives voice commands → ElevenLabs agent processes requests, forwards complex tasks to n8n → n8n uses custom sub-workflows for newsletter creation, content repurposing (Twitter, short-form video), image generation, and deep research reporting.",2025/07/18,https://www.reddit.com/r/n8n/comments/1mch7p6/i_built_an_ai_voice_agent_that_replaced_my_entire/,,5,Reddit,dudeson55
AI Viral Video Scriptwriter,"Workflow ingests scraped AI news stories, selects top stories via prompt engineering, then generates viral TikTok/Instagram video scripts with multiple hook options and shares them to Slack.",2025/07/18,https://www.reddit.com/r/n8n/comments/1loafvx/i_built_this_ai_automation_to_write_viral/,,5,Reddit,dudeson55
Faceless Shorts Automation,"n8n workflow automatically converts ideas into AI-generated images, creates engaging videos with sound effects, producing complete faceless short-form content without manual input.",2025/07/18,https://www.skool.com/ai-automation-society/new-video-how-i-automated-faceless-shorts-with-ai-in-n8n-free-template,,3,Skool,Nate Herk
Multi Agent Assistant,"Advanced AI personal assistant in n8n coordinates multiple specialized sub-agents instead of calling tools directly, creating a scalable agent-driven framework for complex task automation.",2025/07/20,https://www.skool.com/ai-automation-society/ai-personal-assistant-20-this-agent-calls-other-agents-no-code-in-n8n,,4,Skool,Nate Herk
n8n Workflow Auditor,"Takes a JSON export of n8n workflows as input, processes it with a Python script, and outputs a PDF report detailing workflow costs, execution times, slowest nodes, and potential bottlenecks.",2025/07/20,https://www.reddit.com/r/n8n/comments/1k7j64f/built_a_simple_tool_to_audit_your_n8n_workflows/,,4,Reddit,Sufficient_Figure778
AI News Scraping Pipeline,"Workflow uses RSS feeds and Firecrawl API to scrape news articles, convert them to markdown, and save them to Google Drive.",2025/07/20,https://www.reddit.com/r/n8n/comments/1kzaysv/i_built_a_workflow_to_scrape_virtually_any_news/,,4,Reddit,dudeson55
YouTube Channel RAG Chatbot,"Takes a YouTube channel URL as input, processes it by adding all video transcripts to a RAG store, and outputs a chat interface allowing users to converse with the channel's content.",2025/07/20,https://www.reddit.com/r/n8n/comments/1ldsse5/this_system_adds_an_entire_youtube_channel_to_a/,,4,Reddit,LargePay1357
AI Image Generator,"n8n workflow uses OpenAI's image API to automatically generate marketing visuals, eliminating manual design work and saving hours of creative production time weekly.",2025/07/20,https://www.skool.com/ai-automation-society/new-video-openais-image-api-just-changed-the-game-save-10-hoursweek,,3,Skool,Nate Herk
YouTube Strategy Agent,"AI agent in n8n analyzes high-performing videos in your niche, identifies success patterns, monitors comments for video ideas, and provides weekly strategic insights for content optimization.",2025/07/20,https://www.skool.com/ai-automation-society/new-video-i-built-a-yt-strategist-ai-agent-that-makes-me-6kmo,,4,Skool,Nate Herk
Email Scraping Automation,"Automated workflow scrapes unlimited emails from custom searches using n8n, extracts contact data, and exports results directly to Google Sheets.",2025/07/20,https://www.skool.com/ai-automation-society/new-video-step-by-step-scrape-unlimited-emails-for-free-with-n8n,,3,Skool,Nate Herk
AI Educational Video Generator,"Takes a user-provided question as input → generates an educational dialogue script using Anthropic AI, converts it to speech using ElevenLabs, and combines it with visuals using Json2Video → outputs a short educational video.",2025/07/20,https://www.reddit.com/r/n8n/comments/1lbwq0f/i_built_tiktok_brainrot_generator_includes/,,4,Reddit,SignatureSharp3215
Ultimate AI Team,"Centralized AI assistant in n8n manages four specialized sub-agents, each handling specific domains, creating a scalable and efficient multi-agent system for comprehensive task automation.",2025/07/20,https://www.skool.com/ai-automation-society/new-video-i-built-the-ultimate-team-of-ai-agents-in-n8n-with-no-code-free-template,,4,Skool,Nate Herk
AI Appointment Booker,"AI agent in n8n automatically handles appointment booking requests while you sleep, managing scheduling, availability checks, and calendar integration for business automation.",2025/07/20,https://www.skool.com/automate-with-n8n-7409/steal-this-ai-agent-that-books-appointments-in-your-sleep,,4,Skool,Tiago Lemos
AI Viral Video Clipper,Takes a YouTube video URL as input → analyzes it using AI to identify high-virality short-form clips → outputs shareable links for TikTok/Reels/Shorts via Slack.,2025/07/20,https://www.reddit.com/r/n8n/comments/1m0o40i/i_built_an_ai_workflow_that_analyzes_longform/,,4,Reddit,dudeson55
AI Bigfoot Vlog Generator,Takes a simple idea as input → generates a detailed script for an 8-scene Bigfoot vlog using Veo 3 → outputs individual video clips to Google Drive.,2025/07/20,https://www.reddit.com/r/n8n/comments/1lkbx2b/i_built_this_ai_automation_that_generates_viral/,,4,Reddit,dudeson55
Viral Video Monitor,"n8n automation tracks competitor channels for viral video performance, analyzes successful content patterns, and delivers trending video ideas directly to your inbox on autopilot.",2025/07/21,https://www.skool.com/automate-with-n8n-7409/build-this-n8n-automation-and-finds-infinite-and-free-viral-video-ideas,,3,Skool,Tiago Lemos
n8n Autoscaling Docker Compose,"Simplifies n8n queue mode setup for autoscaling worker containers based on Redis queue length. Includes built-in Puppeteer and Chrome for advanced scraping directly within n8n code nodes. Auto-installs and configures with Docker, enabling high parallel throughput.",2025/07/21,https://www.reddit.com/r/n8n/comments/1kgxgo4/i_made_a_docker_compose_for_n8n_queue_mode_with/,,4,Reddit,conor_is_my_name
Automated Social Media Posting,Takes news headlines or custom text input → Researches and expands on the topic using Perplexity → Generates engaging social media copy with an LLM → Creates visuals using branded Canva templates → Auto-posts to Instagram.,2025/07/21,https://www.reddit.com/r/n8n/comments/1l6vum8/from_news_headline_to_instagram_post_in_2_minutes/,,4,Reddit,postigodiego
N8N News Tracker,"AI-powered workflow monitors n8n updates, new features, and workflow ideas across multiple sources, delivering curated summaries via email to keep users current with platform developments.",2025/07/21,https://www.skool.com/automate-with-n8n-7409/if-you-use-n8n-you-need-to-see-this-right-now,,4,Skool,Tiago Lemos
AI Dental Booking Agent,This workflow uses ElevenLabs and n8n to create an AI-powered voice agent that handles after-hours appointment bookings for a dental practice. It takes incoming calls → interacts with Google Calendar to check availability and book appointments → logs details to a Google Sheet.,2025/07/21,https://www.reddit.com/r/n8n/comments/1m37l5z/i_recreated_a_dentist_voice_agent_making_24kyr/,,4,Reddit,dudeson55
Personalized Hotel Rewards Email,"Workflow takes high-spending hotel guest data from Salesforce, uses Gemini AI to personalize reward email content, and sends emails via Brevo.",2025/07/21,https://www.reddit.com/r/n8n/comments/1m2fl2l/i_got_paid_for_this_simple_workflow_a_200_now_i/,,4,Reddit,Charming_You_8285
Automated Short Video Generator,"Takes text input (jokes, tips, stories) → generates short videos with background footage, captions, and AI-generated voiceover → outputs video file.",2025/07/21,https://www.reddit.com/r/n8n/comments/1k575uq/i_made_a_free_mcp_server_to_create_short_videos/,,4,Reddit,davidgyori
Google Maps Leads,"Takes search queries as input → Scrapes Google Maps for relevant data → Outputs structured JSON data containing location details like name, place ID, coordinates, address, rating, reviews, categories, website, phone number, and Google Maps link.",2025/07/21,https://www.reddit.com/r/n8n/comments/1kml8st/i_made_a_google_maps_scraper_designed/,,4,Reddit,conor_is_my_name
AI Newsletter Generator,"Sequential AI research agents in n8n automatically research topics, compile information, and format professional newsletters with source citations without human intervention.",2025/07/21,https://www.skool.com/ai-automation-society/new-video-steal-this-team-of-research-agents-for-newsletter-automation-in-n8n-no-code,,4,Skool,Nate Herk
AI Research Reporter,"AI system in n8n conducts comprehensive research on any topic, analyzes data from multiple sources, and generates detailed PDF reports with citations for $0.50 per report.",2025/07/21,https://www.skool.com/ai-automation-society/new-video-i-built-deep-research-that-beats-perplexity-openai,,4,Skool,Nate Herk
AI Social Post Generator,"Takes a URL as input, uses Gemini AI to create platform-specific social media posts for X, LinkedIn, Reddit, and Threads, includes a webpage screenshot, and auto-posts to each platform.",2025/07/21,https://www.reddit.com/r/n8n/comments/1luu4iq/i_built_an_n8n_workflow_to_convert_web_articles/,,4,Reddit,mutonbini
AI Newsletter Generator,Workflow scrapes online AI news stories → processes them with AI to select top stories and generate newsletter content → outputs formatted markdown for publishing.,2025/07/21,https://www.reddit.com/r/n8n/comments/1l9pff8/i_built_an_ai_system_that_scrapes_stories_off_the/,,5,Reddit,dudeson55
Technical Analyst Agent,"AI agent in n8n performs automated technical analysis tasks without coding, analyzing financial data and generating trading insights.",2025/07/21,https://www.skool.com/ai-automation-society/new-video-how-i-built-a-technical-analyst-ai-agent-in-n8n-with-no-code,,3,Skool,Nate Herk
RSS Idea Generator,"Workflow gathers news from various RSS feeds related to startups and AI, processes them using an AI agent (Gemini), and outputs structured idea suggestions in JSON, which are then stored in a Google Sheet.  It uses webhooks to accept user prompts and generate ideas on demand.",2025/07/21,https://www.reddit.com/r/n8n/comments/1luyctd/you_guys_loved_my_idea_finder_workflow_so_here_is/,,3,Reddit,Haghiri75
N8N Workflow Collection,This repository contains a collection of over 1000 n8n workflows sourced from the n8n website and various Git repositories.  It provides a wide range of pre-built automations for various tasks and integrations.,2025/07/21,https://www.reddit.com/r/n8n/comments/1kx9u01/all_of_n8n_workflows_i_could_find_1000_enjoy/,,3,Reddit,eliadkid
AI Media Manager,"Voice AI agent in n8n runs complete media operations including daily newsletter writing, Twitter content repurposing, TikTok script creation, and video generation for business automation.",2025/07/21,https://www.skool.com/ai-automation-mastery-group/new-video-this-ai-agent-runs-my-100k-media-company-free-n8n-template,,4,Skool,Lucas Walter
AI Dentist Assistant,"Voice AI agent in n8n handles dental office operations including appointment scheduling, patient inquiries, and administrative tasks, replicating a $24K/year system sold to dentists.",2025/07/21,https://www.skool.com/ai-automation-mastery-group/new-video-24kyear-from-this-ai-dentist-voice-agent-free-n8n-template,,4,Skool,Lucas Walter
Viral Clip Generator,AI system in n8n uses Vizard to automatically extract and generate dozens of viral short clips from YouTube videos for cross-platform social media distribution.,2025/07/22,https://www.skool.com/ai-automation-mastery-group/video-this-ai-system-generates-viral-clips-from-any-youtube-video-n8n-vizard,,3,Skool,Lucas Walter
Video Clone Analyzer,"AI system in n8n uses Apify and Google Gemini to reverse engineer viral TikTok videos, analyzing content and generating detailed prompts for AI video recreation tools like Veo3.",2025/07/22,https://www.skool.com/ai-automation-mastery-group/video-clone-any-viral-ai-video-with-apify-google-gemini-free-n8n-template,,3,Skool,Lucas Walter
Content Repurposing Factory,"AI-powered system in n8n uses Apify and Claude Sonnet to automatically repurpose content across multiple platforms with customizable tone, style, and output formats for scalable content multiplication.",2025/07/22,https://www.skool.com/ai-automation-mastery-group/video-build-your-own-ai-content-repurposing-factory-free-n8n-template,,4,Skool,Lucas Walter
Twitter Data Scraper,Cost-effective Twitter scraping system using n8n and Apify extracts tweet data at 40 cents per thousand tweets for social media monitoring and data collection.,2025/07/22,https://www.skool.com/ai-automation-mastery-group/video-how-to-actually-scrape-data-off-twitter-x-with-apify-free-n8n-template,,3,Skool,Lucas Walter
AI Reel Generator,"AI system in n8n automatically repurposes long-form newsletter content into bite-sized short videos optimized for Instagram, TikTok, and YouTube Shorts distribution.",2025/07/22,https://www.skool.com/ai-automation-mastery-group/this-ai-system-makes-viral-reels-for-me-n8n-free-template,,3,Skool,Lucas Walter
AI Vlog Generator,"AI system in n8n uses Claude and Google VEO 3 to automatically generate viral-style vlogs like Bigfoot content, reverse engineering successful video formats for automated production.",2025/07/22,https://www.skool.com/ai-automation-mastery-group/video-this-ai-system-builds-viral-vlogs-in-minutes,,3,Skool,Lucas Walter
AI Appointment Reminder,"AI voice system in n8n uses VAPI/Twilio to make personalized reminder calls, reduces no-shows to 3%, prevents duplicate calls, and logs confirmations in Google Sheets automatically.",2025/07/22,https://www.skool.com/neural-architects/cut-no-shows-to-3-with-an-ai-voice-reminder-system,,5,Skool,Frank Nillard
YouTube Insights Engine,"Automated workflow in n8n combines YouTube metrics with audience data to identify viral video opportunities before they explode, using Google Sheets for data tracking and analysis.",2025/07/22,https://www.skool.com/neural-architects/how-i-make-viral-videos-with-my-yt-insights-engine-free-templates,,4,Skool,Frank Nillard
AI Sales Agent,"Production-level AI voice agent in n8n calls leads after form submission, qualifies prospects using CRM data, analyzes calls with AI, and automatically schedules follow-up meetings.",2025/07/22,https://www.skool.com/chase-ai-community/create-ai-voice-agents-that-actually-sell,,5,Skool,Chase Hannegan
Viral Strategy Analyzer,"AI system scrapes TikTok and Instagram videos using Apify, analyzes viral patterns with Gemini's video analysis, and generates actionable steps to recreate successful content strategies.",2025/07/22,https://www.skool.com/chase-ai-community/steal-anyones-viral-video-strategy-tiktok-ig-scraper,,4,Skool,Chase Hannegan
AI Video Powerhouse,n8n workflow uses VEO3_fast model via KieAPI to automatically generate videos from Google Sheet prompts and distributes content across 9 social media channels simultaneously using Blotato.,2025/07/22,https://www.skool.com/chase-ai-community/automate-ai-viral-videos-w-veo3fast-kieapi,,4,Skool,Chase Hannegan
Cold Outreach Machine,"Advanced n8n workflow uses Apollo-powered Apify for LinkedIn scraping, integrates Instantly.ai for multi-domain email campaigns with lead warming and success analytics for comprehensive outreach automation.",2025/07/22,https://www.skool.com/chase-ai-community/cold-outreach-machine-30-linkedin-scraper,,5,Skool,Chase Hannegan
RAG Chat System,"Advanced RAG system in n8n handles large Excel/CSV files with SQL functionality, connects to web chat interface via webhooks, and maintains session persistence for conversational AI applications.",2025/07/22,https://www.skool.com/chase-ai-community/rag,,5,Skool,Chase Hannegan
Faceless Video Factory,"Complete n8n automation generates faceless videos from idea to final product including image generation, video creation, audio synthesis, and editing with cost optimization strategies for viral content.",2025/07/22,https://www.skool.com/chase-ai-community/faceless-video-generation,,4,Skool,Chase Hannegan
Apollo Lead Generator,"AI automation uses Apify to scrape Apollo lead data without account requirement, extracting work emails, personal emails, and LinkedIn URLs based on natural language descriptions into Google Sheets.",2025/07/22,https://www.skool.com/chase-ai-community/apollo-lead-generation,,4,Skool,Chase Hannegan
AI Carousel Automation,n8n workflow automatically generates carousel content and posts to TikTok and Instagram using AI for dynamic social media content creation and distribution.,2025/07/22,https://www.skool.com/chase-ai-community/automatically-create-post-carousels-to-socials,,3,Skool,Chase Hannegan
Personal Assistant Agent,"AI personal assistant in n8n integrates Gmail, Google Calendar, and web scraping via Tavily, accessible through Telegram with voice and text interaction for executive assistance tasks.",2025/07/23,https://www.skool.com/chase-ai-community/personal-assistant-ai-agent,,4,Skool,Chase Hannegan
LinkedIn Style Cloner,"n8n workflow analyzes any LinkedIn influencer's content patterns from their URL, creates writing playbooks covering hooks and structure, and generates posts mimicking their voice and style.",2025/07/23,https://www.skool.com/chase-ai-community/steal-their-linkedin-content-strategy,,4,Skool,Chase Hannegan
Stock Analysis Agent,AI agent in n8n performs comprehensive stock analysis combining technical chart analysis with sentiment analysis from Tavily web scraping for informed investment decision-making.,2025/07/23,https://www.skool.com/chase-ai-community/stock-analyzer-ai-agent,,4,Skool,Chase Hannegan
Custom Newsletter AI,"AI system in n8n combines RSS feeds and Tavily to filter articles based on personal interests, creating customized newsletters that deliver only relevant content automatically.",2025/07/23,https://www.skool.com/chase-ai-community/custom-newsletter-ai-workflow,,4,Skool,Chase Hannegan
Multi Platform Poster,"n8n workflow uses Blotato API to simultaneously post content across 9 social media platforms, designed as modular component for integration with existing AI content systems.",2025/07/23,https://www.skool.com/chase-ai-community/social-media-poster-9-platforms,,4,Skool,Chase Hannegan
AI Avatar Creator,n8n automation integrates HeyGen AI avatars to automatically generate and distribute personalized video content across multiple social media platforms daily using your AI clone.,2025/07/23,https://www.skool.com/chase-ai-community/create-your-ai-clone-heygen,,4,Skool,Chase Hannegan
AI Email Assistant,"AI workflow in n8n automatically classifies incoming emails, applies custom tags based on rules, and drafts personalized responses using your writing voice and communication style.",2025/07/23,https://www.skool.com/chase-ai-community/ai-email-assistant,,4,Skool,Chase Hannegan
Maps Leads Business Scraper,n8n workflow scrapes Google Maps for basic business data then enriches it with Perplexity AI to gather additional information including summaries and email addresses for lead generation.,2025/07/23,https://www.skool.com/chase-ai-community/google-maps-business-scraper,,4,Skool,Chase Hannegan
Veo3 Video Generator,"n8n workflow integrates Google's Veo3 video generation through Fal.AI API, creating foundation skeleton for automated video content creation in existing AI systems.",2025/07/23,https://www.skool.com/chase-ai-community/veo3-n8n-skeleton,,3,Skool,Chase Hannegan
Written Content AI Agent,"AI agent in n8n creates high-quality written content mimicking your writing style, handling idea generation, research, drafting, and article creation with Flux integration for accompanying images.",2025/07/23,https://www.skool.com/chase-ai-community/written-content-ai-agent,,4,Skool,Chase Hannegan
GPT Airtable Design Team,"AI agent in n8n orchestrates design workflows from Airtable control panel, managing image creation and complex edits through specialized sub-workflows with automatic request processing and results delivery.",2025/07/23,https://www.skool.com/chase-ai-community/gpt-airtable-design-team,,4,Skool,Chase Hannegan
RAG Voice Frontend,"Advanced RAG system integrates Eleven Labs conversational AI with web frontend, enabling natural voice conversations through standardized webhook architecture for seamless AI assistant interactions.",2025/07/23,https://www.skool.com/chase-ai-community/rag-voice-frontend,,5,Skool,Chase Hannegan
AI Agent Voice Website,"AI personal assistant gains voice capabilities through ElevenLabs integration with custom web frontend using Lovable and Supabase, including database management and authentication for complete AI assistant platform.",2025/07/23,https://www.skool.com/chase-ai-community/giving-our-ai-agent-a-voice-and-a-website,,5,Skool,Chase Hannegan
Podcast to TikTok Clips,AI automation in n8n converts longform podcast episodes into viral TikTok clips through automated content detection and clip generation for complete podcast-to-social transformation.,2025/07/23,https://drive.google.com/file/d/12EiSCXiQ2b9MuZO5LYKE2-4dH9mSW1P1/view?usp=share_link,https://youtu.be/yueOIxkDig0,4,Gumroad,Nick Saraev
Facebook Ad Remixer,n8n automation scrapes high-performing Facebook Ad Library ads and uses AI to remix successful elements into custom creatives based on user prompts for brand-specific advertising campaigns.,2025/07/23,https://drive.google.com/file/d/1ONOFJ_MJjtLCXz3JImkZ5NnLrhfg6W1c/view?usp=share_link,https://youtu.be/GNmlnt52aSM,4,Gumroad,Nick Saraev
AI Facebook Ad Spy,"AI-powered n8n system scrapes top-performing Facebook ads, analyzes success factors, and rewrites them for high-paying clients, creating valuable ad intelligence service worth $2000+.",2025/07/23,https://drive.google.com/file/d/18M8GjOcBQHHzBgxLKpTfl992DkW4N4iO/view?usp=share_link,https://youtu.be/0PJNiDuihBg,5,Gumroad,Nick Saraev
24/7 Personal Assistant,n8n AI agent operates continuously as personal assistant handling diverse tasks automatically without user intervention for round-the-clock productivity support.,2025/07/23,https://drive.google.com/drive/folders/1F3p-sM30ere8k3TG4Ni4XhCNzK_0wJtU?usp=share_link,https://youtu.be/iEzr0GdFitU,4,Gumroad,Jono Catliff
