Title,Description,Date,Link,Setup Support,FINAL SCORE,Origin,Author
AI Design Team,"n8n automation creates 24/7 AI graphic design team that automatically generates logos, brand guides, and gradient backgrounds for continuous design production.",2025/07/23,https://drive.google.com/file/d/18M8GjOcBQHHzBgxLKpTfl992DkW4N4iO/view?usp=share_link,https://youtu.be/DrqR7a7lmBE,4,Gumroad,Nick Saraev
Dynamic First Call Setup,n8n workflow automatically initiates customizable first-call scenarios for incoming webhooks with flexible assistant behavior configuration and simple structure for easy adaptation.,2025/07/23,https://www.skool.com/ai-automation-vault/dynamic-first-call-setup,,4,Skool,Semih S
Master Social Scraper,"n8n workflow scrapes content from X/Twitter, LinkedIn, YouTube, and Instagram with automatic video transcription, designed for competitor analysis, content research, and AI-ready data extraction.",2025/07/23,https://www.skool.com/ai-automation-vault/classroom/69b7bb57?md=9cbd84cbb03b46aa945d79bf4f1cca59,,4,Skool,Nolan Harper
AI Email Classifier,"n8n workflow automatically classifies incoming Gmail messages into 5 categories (Internal, Customer Support, Promotions, Admin/Finance, Sales) and generates appropriate AI-powered responses using specialized LLM prompts for each category.",2025/07/23,https://www.skool.com/ai-automation-vault/classroom/69b7bb57?md=cd5a5ed32cbd4dda828fd2cd8c32637b,,5,Skool,Nolan Harper
Cold Email Automation,"n8n workflow finds ideal prospects, writes personalized cold emails using AI, and sends them automatically for complete end-to-end cold outreach automation without coding.",2025/07/23,https://www.skool.com/ai-automation-vault/classroom/69b7bb57?md=fc95cbb6156341fdb6508690124850c4,https://youtu.be/2Utdn12JSK4,4,Skool,Nolan Harper
AI Proposal Generator,"n8n workflow automatically transcribes sales call recordings, extracts prospect pain points, and generates comprehensive customized proposals with pricing, scope, and upsells based on call analysis.",2025/07/23,https://www.skool.com/ai-automation-vault/classroom/69b7bb57?md=157ad4e2cb374a40b6985ebd9b0973a4,,5,Skool,Nolan Harper
YouTube Comment Miner,AI automation reads YouTube comments from niche videos and transforms them into research-backed content ideas with hooks and outlines for continuous content calendar filling.,2025/07/23,https://www.skool.com/ai-automation-vault/classroom/69b7bb57?md=90be61bf22fb45479c8f8350ab758572,https://youtu.be/Xno2IGHfSDo,4,Skool,Nolan Harper
Sales Assistent,"n8n workflow creates automated AI sales assistant that captures leads, handles follow-ups, and writes custom responses continuously without human intervention for complete sales automation.",2025/07/23,https://www.skool.com/ai-automation-vault/classroom/69b7bb57?md=859eeb89deab4a05a77de17ee5afe5f9,https://youtu.be/1XPu71Hw_ck,5,Skool,Nolan Harper
AI Copywriting Team,"n8n automation creates specialized AI copywriters for cold emails, VSL scripts, and sales letters with trigger-based assistant deployment and high-converting copy generation for business use.",2025/07/23,https://www.skool.com/ai-automation-vault/classroom/69b7bb57?md=b70cf2961eff4f8faf437d0bf168ad3c,https://youtu.be/GoDmjHs7o-M,4,Skool,Nolan Harper
YouTube Growth Automation,"AI automation system helped grow YouTube channel from 515 to 7,423 subscribers in 7 days through strategic content optimization and automated growth tactics.",2025/07/24,https://www.skool.com/ai-automation-vault/classroom/69b7bb57?md=c0857de2eb1c474891084ee6dd75eee4,https://youtu.be/t6iPH93krzY,4,Skool,Nolan Harper
Personalized Cold Email Opener,"n8n system scrapes thousands of emails, adds them to Google Sheets, and generates highly customized personalized cold email openers for each prospect for mass personalization at scale.",2025/07/24,https://www.skool.com/ai-automation-vault/classroom/69b7bb57?md=9fe3c0e980d44ee0b925293c9131946b,https://youtu.be/tY1N75GpzRo,4,Skool,Lloyd Dodgen | Building AI Automation For Agencies
AI Facebook Ad Agency,"n8n automation replaces Facebook ad agencies by generating dozens of ads from product images and Meta Ads Library inspiration, eliminating need for creative teams through AI-powered ad creation.",2025/07/24,https://www.skool.com/ai-automation-vault/classroom/69b7bb57?md=6a5c43eff0d74ba5b9639e167f115df1,https://youtu.be/76eN-hfnT5Q,4,Skool,Lloyd Dodgen | Building AI Automation For Agencies
ChatGPT Automation System,"n8n system integrates ChatGPT with multi-app workflow to automate call scheduling, invoice processing, and spreadsheet updates using webhook triggers, API integrations, and custom GPT generator.",2025/07/24,https://drive.google.com/file/d/1c-JvJLEAla3o28T1rk49Z14HS7fwwjor/view?usp=sharing,https://www.youtube.com/watch?v=YcDLVPYIRSA,4,Gumroad,Jono Catliff
AI Customer Support System,"n8n automation creates comprehensive customer support system integrating Circle community posting, Airtable ticketing dashboard, and AI agent with search tools for automated ticket creation, resolution, and status tracking.",2025/07/24,https://drive.google.com/file/d/1I2UBn1MfxTPj0Jt4B8wQCvXOEJzwgkun/view?usp=sharing,https://www.youtube.com/watch?v=mJwZPK2A7cM,5,Circle,Ben AI
LinkedIn Job Application Bot,"n8n workflow automates LinkedIn job applications through RSS job feeds, AI-powered job fit rating, tailored cover letter generation, and Google Sheets deduplication for complete application automation.",2025/07/24,https://drive.google.com/file/d/1VAIRX3D8fW7A-805LK_VceCG2kHxc0R2/view?usp=sharing,https://www.youtube.com/watch?v=dYNFqM84pSI,4,Gumroad,Jono Catliff
Claude MCP Content Repurposer,"n8n workflow integrates Claude MCP for content repurposing with YouTube transcription, LinkedIn post generation, dynamic image creation, and Airtable/Webflow updates for automated social media and blog content.",2025/07/24,https://drive.google.com/drive/folders/1spHLVKJjE8iLNT08Oky8fnFNhkE5DD1K?usp=share_link,https://www.youtube.com/watch?v=_je0FbUcFkg,4,Circle,Ben AI
Claude MCP Business Agent,"Comprehensive Claude MCP agent system integrates email, calendar, CRM, Slack, WhatsApp, and LinkedIn through n8n-based MCP server with API configurations for automated daily business task management.",2025/07/24,https://drive.google.com/drive/folders/1EpwvEo824ZW3TXY99_AQwEbgvrAwXjre?usp=sharing,https://www.youtube.com/watch?v=bATMtzNoap4,5,Circle,Ben AI
Multi-Platform Sales Automation,"AI system automates sales across WhatsApp, Facebook Messenger, and Instagram DMs using multi-agent setup with CRM integration, calendar scheduling, RAG database, and MCP integration for dynamic tool selection.",2025/07/24,https://drive.google.com/drive/folders/1S_fyqX4Vmhs-f8UvaqbEGImQ2fFFG7zl?usp=share_link,https://www.youtube.com/watch?v=VnbfsX7iBl4,5,Circle,Ben AI
Google Sheets Automation Hub,"Dynamic Google Sheets dashboard uses form triggers, conditional logic, and Apps Script to automate emails, calendar invites, and invoices with external system integration and switch-case routing.",2025/07/24,https://drive.google.com/drive/folders/1uA6tQ03PtYBktxAU4Hk1hxzeWc5z7PKz?usp=share_link,https://www.youtube.com/watch?v=Mw9AIejD39s,4,Gumroad,Jono Catliff
Lead Follow-up Automation,"n8n workflow captures form submissions, integrates with GoHighLevel CRM for instant outbound calls, logs data to Google Sheets, and sends Telegram notifications for maximum lead conversion automation.",2025/07/24,https://drive.google.com/file/d/1-ojHHwjobmDQd5It465u2v2CXY_lG7uc/view?usp=sharing,https://www.youtube.com/watch?v=PWLVWhMh7og,4,Gumroad,Jono Catliff
n8n Automation Template Hub,"A curated collection of 250+ community-contributed n8n automation templates spanning various categories like AI, productivity, social media, and more.  Provides a central repository for discovering and accessing pre-built workflows.",2025/07/24,https://www.reddit.com/r/n8n/comments/1khyn91/250_free_n8n_automation_templates_the_ultimate/,,4,Reddit,evoura
Real-Time X Insights Agent,This workflow takes user queries from a Bolt frontend → processes them via a Supabase edge function and an n8n workflow using Grok's Live Search API → outputs real-time insights from X.,2025/07/24,https://drive.google.com/file/d/1phOwtWTazvIUMo6NBssmwj-_vupwSXiL/view?usp=drivesdk,https://www.youtube.com/watch?v=7NIN0KNcVdM,4,Gumroad,Mark Kashef
TikTok Viral Analysis,"This workflow analyzes top-performing TikToks from specified influencers. It retrieves recent videos, sorts by views, filters for video posts, and uses Gemini to extract viral elements.",2025/07/24,https://drive.google.com/file/d/1wtEIVdNb4pyvlqqxW0Hu0UPON47yhZ0x/view?usp=drivesdk,https://www.youtube.com/watch?v=OSpw9AY1fJI,4,Youtube,Oleg Melnikov
Make to n8n Converter,"This workflow takes Make.com blueprints (JSON) as input, processes them using GPT-3 and Perplexity AI to handle conversions and unsupported integrations, and outputs functional n8n workflow templates.",2025/07/24,https://drive.google.com/file/d/1mYKYaQzdGEKjf6uzfgcVIKZi10oxYA6j/view?usp=sharing,https://www.youtube.com/watch?v=bK_4qJiQ5IM,4,Gumroad,Mark Kashef
AI Video Analysis Automation,"Workflow automates video analysis using Google Gemini. Takes local video files or YouTube URLs as input, polls processing status, and outputs Gemini's analysis (e.g., summaries, insights).",2025/07/24,https://drive.google.com/file/d/1-Mua06hJHTuf5KUAEA9DdeGhSMy2Rxaq/view?usp=drivesdk,https://www.youtube.com/watch?v=acB2o6nwAn8,4,Skool,Nate Herk
Prompt Optimization Workflow,Takes inconsistent AI prompts as input → processes and optimizes using techniques like temperature control and structured output → outputs consistent and reliable AI responses.,2025/07/24,https://drive.google.com/file/d/10WGVKjPhhI4jlQEknZ-Wx_Ah5Bbec3r9/view?usp=drivesdk,https://www.youtube.com/watch?v=1uDXVb7zp0Q,4,Gumroad,MagicOps AI
AI Email Automation,"Workflow automates email inbox management. Takes incoming emails as input → classifies them using OpenAI into categories (priority, support, promo, finance) → generates drafts and sends notifications via Telegram.",2025/07/24,https://drive.google.com/file/d/1IDr2ShxpJ6mQbv1Ypyn-uT1QH7sqqUan/view?usp=drivesdk,https://www.youtube.com/watch?v=JUx2ZfNfD64,4,Skool,Nate Herk
AI Image Generation and Merging,Takes text prompts or existing images as input → Processes them using OpenAI's image model and/or combines images → Outputs generated or merged images.,2025/07/24,https://drive.google.com/file/d/1nLk7Xf6AqU0RuArdESu87hNbcah7UZRT/view?usp=drivesdk,https://www.youtube.com/watch?v=nGNm4IBZpGg,4,Gumroad,Jono Catliff
AI Marketing Automation,"Workflow scrapes Google and Instagram for data, uses LLMs to summarize content, plan posts, generate images, and updates Google Sheets/Drive via webhook.",2025/07/24,https://drive.google.com/file/d/1esph4j-3cO-oDyvBsM-wsbfk0u5xBTfv/view?usp=drivesdk,https://www.youtube.com/watch?v=7TUPVDIcD3k,4,GitHub,Rory Ridgers
Automated Invoice Processing,"This workflow takes invoice images via Telegram → extracts text using OCR, updates a database, uploads the image to Google Drive → and sends a summary back to Telegram.",2025/07/24,https://drive.google.com/file/d/1yJ66v6Jgj9MNw5FvjXcqLo91Y2HO7w5G/view?usp=drivesdk,https://www.youtube.com/watch?v=skHe-qIRkM4,4,Skool,Nate Herk
AI Email Automation Agent,"Takes natural language prompts as input → Processes them with GPT-4, using memory and Google Sheets contact lookup → Outputs automated email responses via Gmail.",2025/07/24,https://drive.google.com/file/d/1ly26cSEV2pS0PIbqVIphghnGtrnliA_c/view?usp=drivesdk,https://www.youtube.com/watch?v=DAbnhOOFuD8,4,GitHub,Rory Ridgers
SMS AI Agent Builder,"This workflow automates the creation of an SMS AI agent. It takes an incoming SMS message via Twilio as input, processes it using Google Sheets for context and buffering, and then outputs responses via Twilio SMS and email notifications through Gmail.",2025/07/24,https://drive.google.com/file/d/1ihs-A4mWLMkkSTNgAZGndRYc46kSue8u/view?usp=drivesdk,https://www.youtube.com/watch?v=_igpx9vXYvA,3,GitHub,Rory Ridgers
AI Agent API Integration,"This workflow automates the creation of AI agents by integrating external APIs like Open Weather Map, Perplexity, and Tavi using HTTP requests, handling authentication, parameters, and error responses.",2025/07/24,https://drive.google.com/file/d/14Pbsv4oHqWSCKFfDSjfj9ye7IdCY5PHb/view?usp=drivesdk,https://www.youtube.com/watch?v=qZkX_gIlwsY,4,Skool,Nate Herk
AI Web App Builder,"Takes user inputs (company name, industry, website URL) → processes them using Lovable's natural language coding, OpenAI, and Dolly 3 → outputs a custom web application and tailored social media posts.",2025/07/24,https://drive.google.com/file/d/1z_8TrHcoLj98QGOmSUP64JoegtVhKHh8/view?usp=drivesdk,https://www.youtube.com/watch?v=i08K-l8pjfs,4,Gumroad,Jono Catliff
AI-Powered Client Onboarding,"This workflow automates client onboarding from a form submission. It creates Google Drive folders, ClickUp projects/tasks, a dedicated Slack channel, and uses AI to extract tasks from documents, leveraging Google Drive, ClickUp, Slack, and Gmail APIs.",2025/07/24,https://drive.google.com/file/d/1MK9vE-QxlI2N9kHgpxLrQZu1fliG4mcW/view?usp=drivesdk,https://www.youtube.com/watch?v=gXKzEt1ZG38,4,Skool,Nolan Harper
AI Voice Travel Agent,"Takes travel details via webhook → retrieves flight, hotel, and activity data using APIs → outputs a personalized HTML email with itinerary details.",2025/07/24,https://drive.google.com/file/d/15soElZ8yZP2nCkdhGGYvzn_0Wc39vMVg/view?usp=drivesdk,https://www.youtube.com/watch?v=5zhTxuuPc3A,4,Skool,Nate Herk
AI Chatbot Web UI Integration,"This workflow integrates a ChatGPT-style web UI with n8n AI agents. It takes user chat input via Open WebUI, processes it using webhook triggers and header authentication, generates conversation metadata, and outputs AI responses.  It also integrates external tools like the Brave search API.",2025/07/24,https://drive.google.com/file/d/1Mte9aRJGON1TUssBEf0sk9cqn4EC-GaD/view?usp=drivesdk,https://www.youtube.com/watch?v=6zn8vVTeFE0,4,GitHub,Cole Medin
AI-Powered Outlook Manager,"Workflow triggers on new Outlook emails → cleans HTML content using OpenAI → classifies emails via AI into categories (high priority, billing, promotional) → routes emails, drafts replies, and sends Telegram notifications based on category.",2025/07/24,https://drive.google.com/file/d/1QQUI5J3TnjdJulpRoAMZS50UHZdvDbWl/view?usp=drivesdk,https://www.youtube.com/watch?v=h7BLVKh7yzc,4,Skool,Nate Herk
Leads from Google Maps Scraper,"This workflow scrapes lead emails from Google Maps search results using HTTP requests and regex. It processes data with custom JavaScript, filters unwanted domains and duplicates, and manages rate limits via loops and waits. The output is a list of scraped email leads.",2025/07/24,https://drive.google.com/file/d/1UqupFZgHJhGII2Vq63PIJ5n15P_7c4EI/view?usp=drivesdk,https://www.youtube.com/watch?v=OroDNJl-pyc,3,Gumroad,Nick Saraev
AI Viral Shorts Automation,"This workflow automates the creation and publishing of faceless short-form videos. It pulls data from Google Sheets, generates content ideas using AI, creates visuals with PI API, renders videos via Runway ML, edits with CreateTomate, and publishes to YouTube using Google Cloud API.",2025/07/24,https://drive.google.com/file/d/1XbPWRK1i_TDRLHJzQ2duFVpj_DwWp5uM/view?usp=drivesdk,https://www.youtube.com/watch?v=oMcLgseGER0,4,Youtube,Oleg Melnikov
AI-Powered Support Automation,"This workflow automates customer support ticket resolution by using an AI agent integrated with OpenAI, Postgres, Supabase, Airtable, Google Drive, and Google Calendar. It takes customer queries as input, processes them through the AI agent with dynamic chat memory and document retrieval, and outputs solutions like FAQs, package tracking, ticket creation, or call scheduling.",2025/07/24,https://drive.google.com/file/d/1m7EiHZl87NfRHq2-y5hT4LjXwKfbnBPw/view?usp=drivesdk,https://www.youtube.com/watch?v=LCRxRnsWErs,5,Skool,5minAI
AI Model RAG Benchmarking,"This workflow benchmarks GPT-4o, Claude 3.5, and Gemini Flash 2.0 for Retrieval-Augmented Generation using Nvidia financial data. It takes a query as input, retrieves relevant context from a vector database, and sends it to each model. The workflow then evaluates and grades the models' responses based on speed, query understanding, and context management, outputting a comparative performance analysis.",2025/07/24,https://drive.google.com/file/d/1NwKcgeqxEnpDjXxQrep-qMmuFbpG_pcE/view?usp=drivesdk,https://www.youtube.com/watch?v=_DbZjllXDv8,5,Skool,Nate Herk
No-Code MCP Deployment Guide,"This guide demonstrates setting up a self-hosted Multiple Choice Prompt (MCP) system using n8n, integrating with services like Airbnb search, Brave search, and Airtable. It covers MCP node installation, server configuration, command execution, parameter handling, and environment variables for streamlined automation.",2025/07/24,https://drive.google.com/file/d/1bVWi32TsBw9-mrDdkFHSYQPDdC07UiaL/view?usp=drivesdk,https://www.youtube.com/watch?v=OUPW4DJMAsA,4,Skool,Nate Herk
Local AI Cloud Stack Deployment,"This workflow automates the deployment of a complete local AI stack using Docker, including LLM (Ollama), databases (Supabase, Qdrant), automation agents (n8n with Flowise), local search (SearXNG), and a user interface (Open WebUI). Input: User configuration and preferences. Process: Orchestrates Docker container setup, configures secured endpoints, firewall, and DNS. Output: Fully functional, private, local AI cloud stack.",2025/07/24,https://drive.google.com/file/d/1vhxXPO4cv9VTgwg0ynY6mg2QavtZmN-i/view?usp=drivesdk,,5,GitHub,Cole Medin
Automated Facebook Ad Analyzer,"Scrapes Facebook ads, categorizes them by type (video, image, text), analyzes them using GPT-4.5 and Gemini API, and stores the results in Google Sheets.",2025/07/24,https://drive.google.com/file/d/1DRmcXJsjPeSEtIk0ggPeGqJxH_37rflc/view?usp=drivesdk,https://www.youtube.com/watch?v=0PJNiDuihBg,4,Gumroad,Nick Saraev
AI Viral LinkedIn Posts,"Takes post ideas from Google Sheets, uses AI (Perplexity, Anthropic, OpenAI) to generate content and images, and auto-publishes to LinkedIn, Instagram, and Twitter based on a schedule.",2025/07/24,https://drive.google.com/file/d/1vLgJdV2a_oKiEZm96NNMlOf5NFCi8EBY/view?usp=drivesdk,https://www.youtube.com/watch?v=YpXzTSZ6csw,4,Youtube,Oleg Melnikov
AI Personal Assistant Workflow,"Telegram triggers a workflow processing voice/text commands to manage emails (Gmail), calendar (Google Calendar), CRM (Airtable), and generate YouTube video ideas using LLMs and Google Search.",2025/07/24,https://drive.google.com/file/d/16keRhQV4gs7QtNoa3A5QSt9rR8fB-dCT/view?usp=drivesdk,https://www.youtube.com/watch?v=kvY6CMe1Rmc,4,GitHub,Rory Ridgers
AI-Powered Cold Email Outreach,"Takes lead data from Google Sheets, uses OpenAI to generate personalized email subjects, icebreakers, and pitches, then drafts emails in Gmail.",2025/07/24,https://drive.google.com/file/d/1PP4skqpjpQsioYkKr0ukBPabHej21ipp/view?usp=drivesdk,https://www.youtube.com/watch?v=6b442bN0CyI,4,Gumroad,Nick Saraev
Automated Hiring Process,"This workflow automates hiring by processing Indeed applications via Gmail, categorizing them using OpenAI, syncing data with Google Sheets, and scheduling interviews through cal.com.",2025/07/24,https://drive.google.com/file/d/1UFN2UT3jbOnM3wQOqLpM7YaiVYTXhvMN/view?usp=drivesdk,https://www.youtube.com/watch?v=dBTrOcWkYM0,4,Gumroad,Jono Catliff
Web Scraper & Screenshotter,"Takes search queries as input → scrapes websites using Firecrawl API, captures screenshots → outputs data in various formats (Markdown, HTML, JSON, screenshots)",2025/07/24,https://drive.google.com/file/d/19otHS7IwZ0yLcYFoIdK4SS1lDo1gOyt9/view?usp=drivesdk,https://www.youtube.com/watch?v=3Pim6uCASSE,4,Skool,Nate Herk
AI Content Approval Workflow,"This workflow uses GPT-4.1 and Tavly search to generate social media content, then routes it through Telegram for human approval or revision requests.  Approved content is then output for publishing.",2025/07/24,https://drive.google.com/file/d/19qCPj6s8houcSupxYAqHozslOU_nbChx/view?usp=drivesdk,https://www.youtube.com/watch?v=CdnR-fNVPKI,4,Skool,Nate Herk
AI Viral Content Analyzer,"This workflow analyzes trending Instagram Reels and other social media videos. It scrapes video data using Apify, retrieves influencer information from Airtable, and leverages Google Gemini AI to extract key elements like hooks, ideas, and scripts. The output is a detailed analysis of viral content trends.",2025/07/24,https://drive.google.com/file/d/1ZsTtRpp2EfYkBHLVuNyUlSodav90H74J/view?usp=drivesdk,https://www.youtube.com/watch?v=zEzcwjZf7c8,4,Youtube,Oleg Melnikov
AI-Powered PPC Ad Automation,"This workflow scrapes top-performing Facebook ads, analyzes them using OpenAI, and generates new creative assets. Input: Facebook Ad Library data. Process: Scraping, AI analysis, content generation. Output: Customized ad creatives.",2025/07/24,https://drive.google.com/file/d/1vhiwbJXEV4wGaYmRjTSM3lt4s-dww4PL/view?usp=drivesdk,https://www.youtube.com/watch?v=GNmlnt52aSM,4,Gumroad,Nick Saraev
Agentic RAG Data Storage,"Workflow takes various data types (PDFs, tabular data) as input → processes and embeds them using Superbase vector database and SQL queries → outputs enhanced data representations for improved AI agent reasoning.",2025/07/24,https://drive.google.com/file/d/1PkpZBOO7W9yeMNsDUnmB6puEljE2Zc2T/view?usp=drivesdk,https://www.youtube.com/watch?v=BhGaGFH0jR4,4,Skool,Nate Herk
AI Viral Video Generator,"Workflow automates AI video creation. Takes video ideas/keywords as input from Google Sheets, generates scripts via AI, uses FAL AI's V3 model to render videos, and outputs finished videos accessible through Google Flow.",2025/07/24,https://drive.google.com/file/d/15aGQy_hGEUOEK7-aGBmkaaOFRfS52M-5/view?usp=drivesdk,https://www.youtube.com/watch?v=axBR8S7AepQ,4,Skool,Mahmut Kasimoglu
AI Resume Screener,"Automates candidate evaluation: receives resumes via email (Gmail) → extracts data, uses multiple AI models (GPT-4, Claude, Gemini, o3) for scoring/ranking → manages results in Airtable.",2025/07/24,https://drive.google.com/file/d/1Eyhm_Sg-LAY0b1q0IdHKtlA1Gj0gwYB-/view?usp=drivesdk,https://www.youtube.com/watch?v=lGnsQ3qWUmk,4,Skool,Mahmut Kasimoglu
Local RAG AI Agent,"Ingests files (PDF, CSV, text) → Extracts, splits, and stores data in PostgreSQL, uses local LLM (Ollama) for RAG and voice API (Cartesia) →  Provides offline, secure document automation.",2025/07/24,https://drive.google.com/file/d/1MJeJlT-5AELRD2DxzLVSfmb1p8V3DfPN/view?usp=drivesdk,https://www.youtube.com/watch?v=T2QWhXpnT5I,4,GitHub,Cole Medin
AI Meeting Prep Automation,"Takes Calendly booking details as input, performs AI-driven research on attendees and their companies using Perplexity API, synthesizes insights with OpenAI, generates personalized prep audio, and sends it via email.",2025/07/24,https://drive.google.com/file/d/1Eu7wPC6RBqhZGf3XGWBBsMNkTGF82TLd/view?usp=drivesdk,https://www.youtube.com/watch?v=9HBa364RZBk,4,Gumroad,Mark Kashef
Google Sheets Automation Hacks,"This workflow automates Google Sheets updates using triggers and webhooks. It processes changes, appends rows, performs calculations with inline functions, integrates ChatGPT for classification and error handling, and manages API rate limits. The output is an updated and enhanced Google Sheet.",2025/07/24,https://drive.google.com/file/d/1AQurQ4t196SXSMUwXP07Kw2cTSVs9Uyc/view?usp=drivesdk,https://www.youtube.com/watch?v=c8D1PP2erbo,4,Gumroad,Jono Catliff
Centralized n8n Error Handler,"This workflow takes error data from any n8n workflow as input, processes it by logging details like timestamps, workflow names, and error messages, and outputs this structured log to a Google Sheet, alongside sending notifications via Slack.",2025/07/24,https://drive.google.com/file/d/1gRHWNmrlfmSV9xHNlkl_VaHMfJzWkYfN/view?usp=drivesdk,https://www.youtube.com/watch?v=bTF3tACqPRU,4,Skool,Nate Herk
AI Multi-Agent Workflow,"This workflow uses multiple AI agents (contact, email, calendar, web search) to automate complex tasks like scheduling, notifications, and quote retrieval. It leverages advanced LLMs (GPT 4.1, Claude 3.5) for decision-making and includes validation steps.",2025/07/24,https://drive.google.com/file/d/14aVUAgn66QkNQJWij8MnuCo5wDJRBN2N/view?usp=drivesdk,https://www.youtube.com/watch?v=WqyLxyALTt0,4,Skool,Nate Herk
AI Email Management,"Workflow automatically categorizes incoming Gmail emails using AI (GPT-4 mini), then performs actions like labeling, summarizing, drafting replies, forwarding, and logging data to Google Sheets.",2025/07/24,https://drive.google.com/file/d/17cqnSqLVDu8Ddl0xG7SQaUvXkIzWY3Nk/view?usp=drivesdk,https://www.youtube.com/watch?v=l0SiFihbetA,4,Gumroad,Jono Catliff
AI Viral Shorts Generator,"Takes Google Sheet input (text prompt) → generates image (Flux), video (Cling), audio (ElevenLabs), combines (Creatomate) → posts to Instagram, TikTok, YouTube (Blotato)",2025/07/24,https://drive.google.com/file/d/1NgmFYiPFy_BOQeDZktdv57CFDkP-W19V/view?usp=drivesdk,https://www.youtube.com/watch?v=BcfjIBd49C8,4,Skool,Nate Herk
AI Voice Clone Agent,"This workflow takes text and audio input from Telegram, transcribes audio to text using OpenAI Whisper, and generates a cloned voice response using ElevenLabs before sending it back to the user.",2025/07/24,https://drive.google.com/file/d/18DhbiKBoaM0hjQltveLSo4k7iZXNKVun/view?usp=drivesdk,https://www.youtube.com/watch?v=QQLEnVCHB1I,4,Gumroad,Jono Catliff
